isbn13,title,author,description,page_count,published_date,publisher,cover_url,cover_filename,genres,series_name,volume_number,audience,intensity,moods,classification_confidence,mood_darkness,pacing_speed,complexity_score,emotional_intensity,plot_archetype,prose_style,setting_atmosphere,vibe_confidence,is_nyt_bestseller,nyt_list_category,nyt_weeks_on_list,nyt_peak_rank
9780316569934,"The Hamptons Lawyer","James Patterson and Mike Lupica","The third book in the Jane Smith thriller series. Taking on a celebrity client proves dangerous.",390,2025,"Little, Brown",https://covers.openlibrary.org/b/id/15106484-L.jpg,9780316569934.jpg,Fiction,"Jane Smith thriller series",3,adult,intense,"suspenseful, tense, mysterious",0.9,7.5,9.5,3,7,whodunit,cinematic,contemporary,0.85,1,"Hardcover Fiction",4,13
9780385551533,"Tonight In Jungleland","Peter Ames Carlin","The author of “Bruce” portrays the making of Springsteen’s album “Born to Run.”",256,2025,Doubleday,https://covers.openlibrary.org/b/isbn/9780385551533-L.jpg,9780385551533.jpg,Fiction,,,adult,moderate,"thought_provoking, inspirational",0.8,3,4,6,5,heros_journey,journalistic,urban,0.7,1,"Hardcover Nonfiction",2,11
9781524746131,"The Undiscovered Country","Paul Andrew Hutton","A narrative history of the American West featuring stories about Daniel Boone, Red Eagle, Davy Crockett, Mangas Coloradas, Kit Carson, Sitting Bull and William “Buffalo Bill” Cody.",580,2025,Dutton,https://covers.openlibrary.org/b/id/15115081-L.jpg,9781524746131.jpg,Fiction,,,adult,moderate,"adventurous, thought_provoking, inspirational",0.9,6,5,6.5,4.5,ensemble,journalistic,wilderness,0.8,1,"Hardcover Nonfiction",1,12
9780063435865,"One Nation Always Under God","Tim Scott","The Republican senator from South Carolina depicts the influence Christianity had on some prominent people and institutions.",256,2025,Broadside,https://covers.openlibrary.org/b/isbn/9780063435865-L.jpg,9780063435865.jpg,Fiction,,,adult,moderate,"thought_provoking, inspirational",0.8,4,3,6,5,ensemble,conversational,other,0.7,1,"Hardcover Nonfiction",2,13
9781464223754,"Handsome Devil","L.J. Shen","The third book in the Forbidden Love series. Gia gets an offer from her boss that she has trouble refusing.",,2025,Bloom,https://covers.openlibrary.org/b/isbn/9781464223754-L.jpg,9781464223754.jpg,Fiction,"Forbidden Love series",3,adult,intense,"romantic, tense",0.8,8,7,3,9,forbidden_love,conversational,contemporary,0.8,1,"Paperback Trade Fiction",1,11
9798217178360,"The Heaven & Earth Grocery Store","James McBride","Secrets held by the residents of a dilapidated neighborhood come to life when a skeleton is found at the bottom of a well.",561,2023,Riverhead,https://covers.openlibrary.org/b/isbn/9780593743775-L.jpg,9798217178360.jpg,Fiction,,,adult,dark,"mysterious, tense, thought_provoking",0.9,7.5,6,6.5,7,ensemble,conversational,small_town,0.8,1,"Paperback Trade Fiction",2,15
9780525555247,"The Anthropocene Reviewed","John Green","A collection of personal essays that review different facets of the human-centered planet.",336,2023,Dutton,https://covers.openlibrary.org/b/id/13534512-L.jpg,9780525555247.jpg,Fiction,,,adult,moderate,"thought_provoking, inspirational, melancholic",0.9,4,2,7,6,other,conversational,contemporary,0.85,1,"Paperback Nonfiction",9,10
9780525565703,"The Wide Wide Sea","Hampton Sides","The author of “On Desperate Ground” depicts Captain James Cook’s final voyage and the controversies surrounding its legacy.",400,2024,Vintage,https://covers.openlibrary.org/b/isbn/9780241437339-L.jpg,9780525565703.jpg,Fiction,,,adult,moderate,"adventurous, thought_provoking, tense",0.85,6,4,7,6,heros_journey,journalistic,wilderness,0.8,1,"Paperback Nonfiction",12,15
9798892792264,"The Happiness Files","Arthur C. Brooks",,,,"Harvard Business Review",https://covers.openlibrary.org/b/isbn/9798892792264-L.jpg,,,,,,,,,,,,,,,,,1,"Advice, How-To & Miscellaneous",1,5
9781454952725,"What To Cook When You Don'T Feel Like Cooking","Caroline Chambers",,,2024,"Union Square & Co",https://covers.openlibrary.org/b/isbn/9781454952725-L.jpg,9781454952725.jpg,,,,,,,,,,,,,,,,1,"Advice, How-To & Miscellaneous",7,7
9781668082461,"Are You Mad At Me?","Meg Josephson",,272,2025,Gallery,https://covers.openlibrary.org/b/isbn/9781668082461-L.jpg,9781668082461.jpg,,,,,,,,,,,,,,,,1,"Advice, How-To & Miscellaneous",2,9
9781338634822,"Wings Of Fire: A Guide To The Dragon World","Tui T. Sutherland","A deeper dive into the legends of the 10 dragon tribes. (Ages 8 to 12)",,2023,Scholastic,https://covers.openlibrary.org/b/id/15122241-L.jpg,9781338634822.jpg,,"Wings Of Fire",,middle_grade,moderate,"adventurous, mysterious, thought_provoking",1,3,3,4,2,other,conversational,other,0.8,1,"Children’s Middle Grade Hardcover",67,10
9781368025621,"The Magical Yet","Angela DiTerlizzi","A being known as the Magical Yet helps children to realize their future potential. (Ages 4 to 8)",40,"Apr 21, 2020","Little, Brown",https://covers.openlibrary.org/b/id/10193669-L.jpg,9781368025621.jpg,,,,children,light,"inspirational, cozy, thought_provoking",0.9,1,4,1,3,coming_of_age,conversational,contemporary,0.8,1,"Children’s Picture Books",7,10
9780593374207,"The Reappearance Of Rachel Price","Holly Jackson","Annabel Price's mother was presumed dead, until she reappears during the filming of a documentary about her disappearance. (Ages 14 to 17)",438,"April 2, 2024",Delacorte,https://covers.openlibrary.org/b/id/15138940-L.jpg,9780593374207.jpg,,,,young_adult,moderate,"mysterious, tense, suspenseful",1,6.5,7.5,4,8,whodunit,conversational,contemporary,0.8,1,"Young Adult Hardcover",38,10
9781982112844,"My Friends","Fredrik Backman","A young woman looks into the story behind a painting that was made 25 years ago and a small group of teens depicted in it; translated by Neil Smith.",448,2025,Atria,https://covers.openlibrary.org/b/isbn/9781982112844-L.jpg,9781982112844.jpg,Fiction,,,adult,moderate,"mysterious, thought_provoking",0.9,5,4,6,8,whodunit,conversational,contemporary,0.8,1,"Combined Print & E-Book Fiction",9,6
9780063384255,"An Inside Job","Daniel Silva","The 25th book in the Gabriel Allon series. The art world, the mob and the Vatican intersect when a Leonardo da Vinci painting goes missing.",480,2025,Harper,https://covers.openlibrary.org/b/isbn/9780063384255-L.jpg,9780063384255.jpg,Fiction,"Gabriel Allon series",25,adult,moderate,"suspenseful, mysterious, tense",0.9,6.5,9,4.5,6,whodunit,cinematic,urban,0.8,1,"Combined Print & E-Book Fiction",4,12
9781668092392,"The Devil Reached Toward The Sky","Garrett M. Graff","The author of “When the Sea Came Alive” provides a narrative account of the people and events involved in and impacted by the creation of the atomic bomb.",576,2025,"Avid Reader",https://covers.openlibrary.org/b/isbn/9781668092392-L.jpg,9781668092392.jpg,Fiction,,,adult,dark,"tense, thought_provoking",0.9,8.5,6.5,7,8,ensemble,cinematic,academic,0.9,1,"Combined Print & E-Book Nonfiction",1,7
9780385548076,"King Of Kings","Scott Anderson","The author of “Lawrence in Arabia” weaves together the history of the Iranian revolution.",530,2025,Doubleday,https://covers.openlibrary.org/b/id/15111867-L.jpg,9780385548076.jpg,Fiction,,,adult,intense,"tense, thought_provoking, melancholic",0.9,8,6,7,8,ensemble,journalistic,urban,0.8,1,"Combined Print & E-Book Nonfiction",1,9
9798228309890,"Ghosts Of Hiroshima","Charles Pellegrino","Firsthand accounts from people affected by the dropping of the atomic bomb on Hiroshima.",,,Blackstone,https://covers.openlibrary.org/b/isbn/9798228309890-L.jpg,,Fiction,,,adult,intense,"melancholic, thought_provoking, tense",0.9,10,6,7,10,ensemble,journalistic,post_apocalyptic,0.9,1,"Combined Print & E-Book Nonfiction",1,12
9781668088784,"Breaking The Law","Alex Marlow","The editor in chief of Breitbart News makes his argument that liberals are exploiting the legal system.",208,2025,"Threshold Editions",https://covers.openlibrary.org/b/isbn/9781668088784-L.jpg,9781668088784.jpg,Fiction,,,adult,intense,"thought_provoking, tense",0.9,7,7,8,7,other,journalistic,contemporary,0.8,1,"Combined Print & E-Book Nonfiction",1,13
9780063384217,"An Inside Job","Daniel Silva","The 25th book in the Gabriel Allon series. The art world, the mob and the Vatican intersect when a Leonardo da Vinci painting goes missing.",410,2025,Harper,https://covers.openlibrary.org/b/id/15103478-L.jpg,9780063384217.jpg,Fiction,"Gabriel Allon series",25,adult,moderate,"suspenseful, mysterious, tense",0.9,6.5,9,4.5,6,whodunit,cinematic,urban,0.8,1,"Hardcover Fiction",4,8
9781250333988,"The Enchanted Greenhouse","Sarah Beth Durst","In this novel set in the world of “The Spellshop,” Terlu Perna must figure out a sorcerer’s secrets to save an island containing magical greenhouses.",384,2025,Bramble,https://covers.openlibrary.org/b/id/15103151-L.jpg,9781250333988.jpg,Fiction,"The Spellshop",,adult,moderate,"mysterious, adventurous",0.9,3,6,4,5,heros_journey,conversational,other,0.8,1,"Hardcover Fiction",4,14
9781668036594,"The Lion Women Of Tehran","Marjan Kamali","Over several decades, the lives of Ellie and Homa ebb and flow against the backdrop of political turmoil in Iran.",,,Gallery,https://covers.openlibrary.org/b/isbn/9781668036594-L.jpg,,Fiction,,,adult,dark,"melancholic, tense, thought_provoking",0.9,7.5,3,6,8,ensemble,conversational,urban,0.8,1,"Paperback Trade Fiction",1,14
9780446569903,"I Am Ozzy","Ozzy Osbourne with Chris Ayres","Colorful stories from the late heavy metal legend, known for his time with Black Sabbath, his solo career and reality TV show.",,2011,"Grand Central",https://covers.openlibrary.org/b/id/6672892-L.jpg,9780446569903.jpg,Fiction,,,adult,intense,"humorous, thought_provoking, adventurous",0.9,7,7,3,8,heros_journey,conversational,urban,0.9,1,"Paperback Nonfiction",3,7
9781546007357,Joyspan,"Kerry Burnight",,,,Worthy,https://covers.openlibrary.org/b/isbn/9781546007357-L.jpg,,,,,,,,,,,,,,,,,1,"Advice, How-To & Miscellaneous",1,5
9781455570249,"Make Your Bed","William H. McRaven","Inspired by the advice Admiral William H. McRaven gave in a graduation speech that went viral, this book is a reminder that sometimes little things can have a big impact.",144,2017,"Grand Central",https://covers.openlibrary.org/b/id/7984714-L.jpg,9781455570249.jpg,,,,adult,light,"inspirational, thought_provoking",0.9,1,4,3,5,other,conversational,contemporary,0.8,1,"Advice, How-To & Miscellaneous",145,10
9780525579045,"The Library Of Unruly Treasures","Jeanne Birdsall","Gwen MacKinnon’s destiny is to save the Ladukan creatures living in the library. (Ages 8 to 12)",350,2025,Knopf,https://covers.openlibrary.org/b/id/15111870-L.jpg,9780525579045.jpg,,,,middle_grade,moderate,"adventurous, mysterious, inspirational",1,2,7,2,4,chosen_one,conversational,academic,0.9,1,"Children’s Middle Grade Hardcover",1,8
9781339022468,"Dragon Masters","Tracey West","Drake, once skeptical of the existence of dragons, now trains his very own. (Ages 6 to 8)",93,2017,Scholastic,https://covers.openlibrary.org/b/isbn/9781443160322-L.jpg,9781339022468.jpg,,,,children,light,"adventurous, inspirational",1,1,6,1,3,heros_journey,conversational,medieval,0.9,1,"Children’s & Young Adult Series",14,5
9798890032706,"Verity Vox And The Curse Of Foxfire","Don Martin","Verity is determined to change the fates of the villagers of Foxfire, but must face a man named Earl and the magic of the mountains. (Ages 14 to 17)",336,2025,"Page Street",https://covers.openlibrary.org/b/isbn/9798890032706-L.jpg,9798890032706.jpg,,,,young_adult,moderate,"adventurous, mysterious, tense",0.9,6,7,3,7,heros_journey,conversational,small_town,0.8,1,"Young Adult Hardcover",1,9
9798217002047,"The Last Tiger","Julia Riew and Brad Riew","Friends turned rivals, Seung and Eunji find themselves on opposite sides of a battle over the last tiger. (Ages 12 and up)",,,Kokila,https://covers.openlibrary.org/b/isbn/9798217002047-L.jpg,,,,,young_adult,moderate,"tense, adventurous, thought_provoking",0.9,6,7.5,3.5,7.5,heros_journey,cinematic,wilderness,0.7,1,"Young Adult Hardcover",2,10
9780593832448,"She Didn'T See It Coming","Shari Lapena","Suspicions arise when Bryden seems to have disappeared from her luxury condo building without any of her belongings.",344,2025,"Pamela Dorman",https://covers.openlibrary.org/b/id/15110806-L.jpg,9780593832448.jpg,Fiction,,,adult,dark,"mysterious, tense, suspenseful",0.95,8,9,3,7,whodunit,cinematic,urban,0.9,1,"Combined Print & E-Book Fiction",1,4
9781668005774,Gwyneth,"Amy Odell","A biography of the actress and founder and chief executive of the lifestyle brand Goop, Gwyneth Paltrow, by the author of “Anna.”",,,Gallery,https://covers.openlibrary.org/b/isbn/9781668005774-L.jpg,,Fiction,,,adult,moderate,"thought_provoking, inspirational",0.9,3,5,6,4,other,journalistic,contemporary,0.9,1,"Combined Print & E-Book Nonfiction",1,5
9781648211898,Vaccines,"John Leake and Peter A. McCullough","An assessment of the history of vaccinations and an argument that the benefits of certain vaccines have been exaggerated by some.",240,2025,"Skyhorse/Children’s Health Defense",https://covers.openlibrary.org/b/isbn/9781648211898-L.jpg,9781648211898.jpg,Fiction,,,adult,moderate,thought_provoking,0.9,7,3,8,4,other,academic,contemporary,0.6,1,"Combined Print & E-Book Nonfiction",1,14
9781464241765,"The Deal","Elle Kennedy","Hannah Wells agrees to tutor the captain of the hockey team whose grades are tanking if he agrees to go on a pretend date with her.",400,2025,Bloom,https://covers.openlibrary.org/b/isbn/9781464241765-L.jpg,9781464241765.jpg,Fiction,,,adult,light,"romantic, humorous",0.9,1,7,2,7,other,conversational,contemporary,0.9,1,"Hardcover Fiction",1,4
9781668080979,"You Belong Here","Megan Miranda","When her daughter gets a scholarship to the college where she experienced tragedy, Beckett Bowery suspects dangers will return.",352,2025,"Marysue Rucci",https://covers.openlibrary.org/b/isbn/9781668080979-L.jpg,9781668080979.jpg,Fiction,,,adult,intense,"suspenseful, tense, mysterious",0.9,8,9,4,8,whodunit,cinematic,contemporary,0.8,1,"Hardcover Fiction",1,5
9780593873922,"Wrath Of The Dragons","Olivia Rose Darling","In this sequel to “Fear the Flames,” Elowen and Cayden face violent attacks, shifting alliances and cutthroat diplomacy.",,,Delacorte,https://covers.openlibrary.org/b/isbn/9780593873922-L.jpg,,Fiction,"Fear the Flames",,young_adult,intense,"adventurous, suspenseful, tense",0.8,7.5,8,6,8,heros_journey,cinematic,medieval,0.7,1,"Hardcover Fiction",1,10
9780593803899,"Being Jewish After The Destruction Of Gaza","Peter Beinart","The editor at large of Jewish Currents and a contributing opinion writer at The New York Times evaluates potential narratives following the war in Gaza.",192,2024,Knopf,https://covers.openlibrary.org/b/isbn/9780593803899-L.jpg,9780593803899.jpg,Fiction,,,adult,intense,"thought_provoking, melancholic, tense",0.8,8,3,8,8,other,journalistic,contemporary,0.7,1,"Hardcover Nonfiction",3,10
9781538768464,"Big Dumb Eyes","Nate Bargatze","The Grammy Award-nominated comedian shares snippets from his life and career.",240,2025,"Grand Central",https://covers.openlibrary.org/b/id/15088268-L.jpg,9781538768464.jpg,Fiction,,,adult,light,"humorous, thought_provoking",0.7,2,7,3,2,other,conversational,contemporary,0.7,1,"Hardcover Nonfiction",11,14
9780593798898,"All The Colors Of The Dark","Chris Whitaker","Questions arise when a boy saves the daughter of a wealthy family amid a string of disappearances in a Missouri town in 1975.",,2024,Crown,https://covers.openlibrary.org/b/id/14643108-L.jpg,9780593798898.jpg,Fiction,,,adult,dark,"mysterious, suspenseful, tense",0.9,8,7,5,7,whodunit,cinematic,small_town,0.8,1,"Paperback Trade Fiction",5,11
9781496755872,"Demon With Benefits","Aurora Ascher","The third book in the Hell Bent series. When a deadly enemy returns, the feelings between Meph and Iris become irrepressible.",,,Kensington,https://covers.openlibrary.org/b/isbn/9781496755872-L.jpg,,Fiction,"Hell Bent series",3,adult,dark,"romantic, suspenseful",0.9,7,7,3,8,forbidden_love,conversational,other,0.8,1,"Paperback Trade Fiction",1,12
9781649377579,"Iron Flame","Rebecca Yarros","The second book in the Empyrean series. Violet Sorrengail’s next round of training under the new vice commandant might require her to betray the man she loves.",640,05/20/2025,"Red Tower",https://covers.openlibrary.org/b/id/15094967-L.jpg,9781649377579.jpg,Fiction,"Empyrean series",2,adult,moderate,"adventurous, romantic, tense",0.9,7,8,4,9,heros_journey,cinematic,medieval,0.8,1,"Paperback Trade Fiction",7,14
9781635575583,"A Court Of Mist And Fury","Sarah J. Maas","The second book in the Court of Thorns and Roses series. Feyre gains the powers of the High Fae and a greater evil emerges.",626,2020,Bloomsbury,https://covers.openlibrary.org/b/id/15152921-L.jpg,9781635575583.jpg,Fiction,"Court of Thorns and Roses series",2,adult,intense,"romantic, adventurous, tense",0.9,7.5,7.5,3.5,9,found_family,flowery,medieval,0.8,1,"Paperback Trade Fiction",42,15
9780300283433,"A Little History Of The United States","James West Davidson","An overview of key figures in our country’s history.",352,2025,Yale,https://covers.openlibrary.org/b/isbn/9780300283433-L.jpg,9780300283433.jpg,Fiction,,,adult,moderate,"thought_provoking, inspirational",0.7,5,7,4,5,ensemble,conversational,other,0.7,1,"Paperback Nonfiction",5,7
9780063306271,"Tiny Humans, Big Emotions","Alyssa Blask Campbell and Lauren Elizabeth Stauble",,,2024,Harvest,https://covers.openlibrary.org/b/isbn/9780063306271-L.jpg,9780063306271.jpg,,,,,,,,,,,,,,,,1,"Advice, How-To & Miscellaneous",1,4
9781401967635,"The Science Of Scaling","Benjamin Hardy and Blake Erickson",,,2024,"Hay House",https://covers.openlibrary.org/b/isbn/9781401967635-L.jpg,9781401967635.jpg,,,,,,,,,,,,,,,,1,"Advice, How-To & Miscellaneous",1,7
9780593734636,"The Book Of Alchemy","Suleika Jaouad",,344,2025,"Random House",https://covers.openlibrary.org/b/isbn/9780593734636-L.jpg,9780593734636.jpg,,,,,,,,,,,,,,,,1,"Advice, How-To & Miscellaneous",5,9
9781626251700,"Adult Children Of Emotionally Immature Parents","Lindsay C. Gibson","If you grew up with an emotionally immature, unavailable, or selfish parent, you may have lingering feelings of anger, loneliness, betrayal, or abandonment. You may recall your childhood as a time when your emotional needs were not met, when your feelings were dismissed, or when you took on adult levels of responsibility in an effort to compensate for your parent’s behavior. These wounds can be healed, and you can move forward in your life.

In this breakthrough book, clinical psychologist Lindsay Gibson exposes the destructive nature of parents who are emotionally immature or unavailable. You will see how these parents create a sense of neglect, and discover ways to heal from the pain and confusion caused by your childhood. By freeing yourself from your parents’ emotional immaturity, you can recover your true nature, control how you react to them, and avoid disappointment. Finally, you’ll learn how to create positive, new relationships so you can build a better life.

Discover the four types of difficult parents:
The emotional parent instills feelings of instability and anxiety
The driven parent stays busy trying to perfect everything and everyone
The passive parent avoids dealing with anything upsetting
The rejecting parent is withdrawn, dismissive, and derogatory",201,2015,"New Harbinger",https://covers.openlibrary.org/b/id/13770729-L.jpg,9781626251700.jpg,,,,adult,intense,"melancholic, inspirational, thought_provoking",1,7.5,3.5,7,9,other,conversational,other,0.9,1,"Advice, How-To & Miscellaneous",9,10
9781665942485,"Growing Home","Beth Ferry","Talking plants, a grumpy goldfish and an inquisitive spider save the Tupper family from utter ruin. (Ages 6 to 9)",272,2025,"Simon & Schuster",https://covers.openlibrary.org/b/id/15158034-L.jpg,9781665942485.jpg,,,,children,light,"humorous, adventurous, cozy",1,1,6,1,3,ensemble,conversational,contemporary,0.95,1,"Children’s Middle Grade Hardcover",10,6
9780593622360,"The Day The Crayons Made Friends","Drew Daywalt","Duncan throws a dinner party to meet all his crayons' new friends. (Ages 4 to 8)",40,2025,Philomel,https://covers.openlibrary.org/b/isbn/9780593622360-L.jpg,9780593622360.jpg,,,,children,light,"humorous, cozy",1,1,4,1,2,found_family,conversational,contemporary,0.9,1,"Children’s Picture Books",8,6
9781368076746,Villains,"Serena Valentino","The stories of Disney’s most feared characters. (Ages 10 to 14)",304,2025,Disney,https://covers.openlibrary.org/b/isbn/9781368076746-L.jpg,9781368076746.jpg,,,,middle_grade,moderate,"mysterious, tense, thought_provoking",1,7,6,3,6,other,conversational,other,0.7,1,"Children’s & Young Adult Series",5,9
9780593711965,"Bones At The Crossroads","LaDarrion Williams","Malik is torn between honing his conjuring powers and living a normal life. (Ages 14 and up)",,,"Labyrinth Road",https://covers.openlibrary.org/b/isbn/9780593711965-L.jpg,,,,,young_adult,moderate,"thought_provoking, adventurous, tense",0.9,6,6,4,7,coming_of_age,conversational,urban,0.7,1,"Young Adult Hardcover",1,10
9780316569941,"The Hamptons Lawyer","James Patterson and Mike Lupica","The third book in the Jane Smith thriller series. Taking on a celebrity client proves dangerous.",,2025,"Little, Brown",https://covers.openlibrary.org/b/isbn/9780316569941-L.jpg,9780316569941.jpg,Fiction,"Jane Smith thriller series",3,adult,intense,"suspenseful, tense, mysterious",0.9,7.5,9.5,3,7,whodunit,cinematic,contemporary,0.85,1,"Combined Print & E-Book Fiction",1,1
9781538773352,"My Good Side","Scheana Shay","The actress and star of the reality TV series “Vanderpump Rules” shares behind-the-scenes stories and struggles she experienced in her life.",256,2025,"Grand Central",https://covers.openlibrary.org/b/isbn/9781538773352-L.jpg,9781538773352.jpg,Fiction,,,adult,moderate,"inspirational, thought_provoking, melancholic",0.9,4,5,3,7,coming_of_age,conversational,contemporary,0.8,1,"Combined Print & E-Book Nonfiction",1,4
9780307389008,"Legacy Of Ashes","Tim Weiner","The Pulitzer Prize–winning journalist examines failures at the Central Intelligence Agency; winner of the National Book Award.",812,2008,Vintage,https://covers.openlibrary.org/b/isbn/9780307389008-L.jpg,9780307389008.jpg,Fiction,,,adult,intense,"suspenseful, tense, thought_provoking",0.9,7,6,8,4,other,journalistic,urban,0.8,1,"Combined Print & E-Book Nonfiction",1,11
9781546009146,Butler,"Salena Zito","A firsthand account of the attempted assassination of Donald Trump during an open-air campaign rally in Pennsylvania on July 13, 2024.",256,2025,"Center Street",https://covers.openlibrary.org/b/isbn/9781546009146-L.jpg,9781546009146.jpg,Fiction,,,adult,intense,"tense, suspenseful, thought_provoking",0.9,8.5,9,6,8,other,journalistic,contemporary,0.85,1,"Combined Print & E-Book Nonfiction",3,13
9780593726341,"Arcana Academy","Elise Kova","To get out of prison, Clara Graysword makes a deal with the headmaster of the Arcana Academy to help him steal a tarot card from the king.",574,2025,"Del Rey",https://covers.openlibrary.org/b/isbn/9781399746243-L.jpg,9780593726341.jpg,Fiction,,,young_adult,moderate,"tense, mysterious, adventurous",0.8,6,8,4,7,redemption_arc,cinematic,academic,0.7,1,"Hardcover Fiction",1,5
9781538771228,"Rose In Chains","Julie Soto","After the dark forces win the war, Evermore's princess, Briony Rosewood, is auctioned off to a member of a family known for its viciousness.",464,2025,Forever,https://covers.openlibrary.org/b/isbn/9781538771228-L.jpg,9781538771228.jpg,Fiction,,,adult,dark,"tense, melancholic, romantic",0.85,8,6,5,8,enemies_to_lovers,conversational,dystopian,0.75,1,"Hardcover Fiction",3,13
9781668025628,"The Woman In Suite 11","Ruth Ware","The second book in the Lo Blacklock series. Blacklock attends the opening of a luxury Swiss hotel and gets swept up in a dangerous pursuit across Europe.",400,2025,Gallery/Scout,https://covers.openlibrary.org/b/id/15099466-L.jpg,9781668025628.jpg,Fiction,"Lo Blacklock series",2,adult,intense,"suspenseful, mysterious, adventurous",0.9,7,9,3,7,fish_out_of_water,conversational,contemporary,0.85,1,"Hardcover Fiction",3,14
9798217047802,"Who Is Government?","Michael Lewis",,272,2025,Riverhead,https://covers.openlibrary.org/b/isbn/9798217047802-L.jpg,9798217047802.jpg,Fiction,,,,,,,,,,,,,,,1,"Hardcover Nonfiction",8,11
9780063270183,"The Mission","Tim Weiner","The author of “Legacy of Ashes” chronicles changes and struggles at the Central Intelligence Agency in the 21st century.",336,2025,Mariner,https://covers.openlibrary.org/b/isbn/9780063270183-L.jpg,9780063270183.jpg,Fiction,,,adult,moderate,"thought_provoking, tense",0.85,7,4,8,4,other,journalistic,contemporary,0.8,1,"Hardcover Nonfiction",2,12
9781982185824,"I'M Glad My Mom Died","Jennette McCurdy","The actress and filmmaker describes her eating disorders and difficult relationship with her mother.",320,"9th August 2022","Simon & Schuster",https://covers.openlibrary.org/b/id/14611415-L.jpg,9781982185824.jpg,Fiction,,,adult,intense,"melancholic, thought_provoking, tense",0.9,9,6,6,10,coming_of_age,conversational,contemporary,0.85,1,"Hardcover Nonfiction",90,13
9780593438534,"Every Summer After","Carley Fortune","The love story of Percy and Sam is told over the course of six summers and one weekend.",,2022,Berkley,https://covers.openlibrary.org/b/id/12752489-L.jpg,9780593438534.jpg,Fiction,,,adult,moderate,"romantic, melancholic",0.9,3,5,2,8,other,conversational,contemporary,0.8,1,"Paperback Trade Fiction",17,12
